{
  "$schema": "http://json-schema.org/draft-07/schema#",
  "title": "KeyRadar pricing table",
  "type": "object",
  "required": ["schema_version", "currency", "updated_at", "providers"],
  "properties": {
    "schema_version": { "const": 2 },
    "currency": { "const": "USD" },
    "updated_at": { "type": "string", "pattern": "^\\d{4}-\\d{2}-\\d{2}$" },
    "_doc": { "type": "string" },
    "providers": {
      "type": "object",
      "additionalProperties": {
        "type": "object",
        "required": ["source_url", "checked_at", "models"],
        "properties": {
          "source_url": { "type": "string" },
          "checked_at": { "type": "string", "pattern": "^\\d{4}-\\d{2}-\\d{2}$" },
          "models": { "type": "array", "items": { "$ref": "#/definitions/entry" } }
        }
      }
    }
  },
  "definitions": {
    "entry": {
      "type": "object",
      "required": ["model", "unit"],
      "properties": {
        "model": { "type": "string", "minLength": 1 },
        "unit": {
          "enum": ["per_mtoken", "per_mchar", "per_image", "per_second", "per_request"],
          "description": "과금 단위. per_mtoken/per_mchar는 100만 단위당 USD."
        },
        "input": { "type": "number", "minimum": 0 },
        "output": { "type": "number", "minimum": 0 },
        "price": { "type": "number", "minimum": 0,
          "description": "입출력 구분이 없는 단위(per_image, per_second, per_request)에서 씁니다." },
        "cache_read": { "type": "number", "minimum": 0 },
        "cache_write": { "type": "number", "minimum": 0,
          "description": "캐시 생성(쓰기) 단가. TTL이 여러 개인 프로바이더(예: Anthropic의 5분/1시간)는 가장 짧은 TTL 단가만 씁니다. 더 긴 TTL은 보통 더 비싸므로 이 필드로 그 비용을 추정하지 마십시오." },
        "reasoning_output": { "type": "number", "minimum": 0,
          "description": "추론 토큰이 별도 단가일 때만 씁니다." },
        "tier_dependent": { "type": "boolean",
          "description": "true면 이 모델의 단가가 프롬프트 길이 등 조건에 따라 달라져 input/output 숫자만으로는 전체를 표현할 수 없다는 뜻입니다. 조건은 note에 적습니다. scripts/build_v1.py는 이 값이 true인 모델을 구버전(v1) 출력에서 제외합니다." },
        "note": { "type": "string" }
      },
      "allOf": [
        {
          "if": { "properties": { "unit": { "enum": ["per_mtoken", "per_mchar"] } } },
          "then": { "required": ["input", "output"] }
        },
        {
          "if": { "properties": { "unit": { "enum": ["per_image", "per_second", "per_request"] } } },
          "then": { "required": ["price"] }
        }
      ]
    }
  }
}
